{
  "schema_version": "0.1",
  "feed_version": "2026-06-04",
  "generated_at": "2026-06-05T09:16:45+09:00",
  "overall_status": "ok",
  "source_count": 3,
  "failed_source_count": 0,
  "sources": [
    {
      "id": "pnu-main-notice",
      "name": "부산대 대학공지",
      "official_url": "https://www.pusan.ac.kr/kor/CMS/Board/PopupBoard.do?mgr_seq=3&mode=list",
      "adapter": "pusan-cms-static-board",
      "category": "university_notice",
      "poll_interval_minutes": 30,
      "public_only": true,
      "access_policy": "public_official_url_only",
      "status": "ok",
      "last_checked_at": "2026-06-05T09:16:45+09:00",
      "last_success_at": "2026-06-05T09:16:45+09:00",
      "last_error_at": null,
      "next_check_at": "2026-06-05T09:46:45+09:00",
      "backoff_until": null,
      "error_count": 0,
      "skipped_reason": null,
      "item_count": 21,
      "error_type": null,
      "error": null
    },
    {
      "id": "pnu-onestop-notices",
      "name": "부산대 학지시 공지",
      "official_url": "https://onestop.pusan.ac.kr/page?menuCD=000000000000386",
      "adapter": "onestop-js-board",
      "category": "academic_notice",
      "poll_interval_minutes": 30,
      "public_only": true,
      "access_policy": "public_official_url_only",
      "status": "ok",
      "last_checked_at": "2026-06-05T09:16:45+09:00",
      "last_success_at": "2026-06-05T09:16:45+09:00",
      "last_error_at": null,
      "next_check_at": "2026-06-05T09:46:45+09:00",
      "backoff_until": null,
      "error_count": 0,
      "skipped_reason": null,
      "item_count": 36,
      "error_type": null,
      "error": null
    },
    {
      "id": "pnu-onestop-scholarship",
      "name": "부산대 장학공지",
      "official_url": "https://onestop.pusan.ac.kr/page?menuCD=000000000000062",
      "adapter": "onestop-js-board",
      "category": "scholarship_notice",
      "poll_interval_minutes": 30,
      "public_only": true,
      "access_policy": "public_official_url_only",
      "status": "ok",
      "last_checked_at": "2026-06-05T09:16:45+09:00",
      "last_success_at": "2026-06-05T09:16:45+09:00",
      "last_error_at": null,
      "next_check_at": "2026-06-05T09:46:45+09:00",
      "backoff_until": null,
      "error_count": 0,
      "skipped_reason": null,
      "item_count": 35,
      "error_type": null,
      "error": null
    }
  ]
}
